{
  "$schema": "https://loxtep.io/schemas/template/workflow.json",
  "template_type": "workflow",
  "slug": "connector-ingestion",
  "name": "Connector Ingestion Workflow",
  "description": "Auto-provisioned ingestion workflow for connector entities. Syncs data from authenticated connectors (Shopify, Stripe, etc.) to data products with graph storage enabled.",
  "version": "1.0.0",
  "tags": [
    "connector",
    "api",
    "polling",
    "ingestion",
    "graph"
  ],
  "use_cases": [
    "Auto-provision on connector OAuth success",
    "Sync orders, products, customers from e-commerce connectors",
    "Graph storage for entity context resolution"
  ],
  "entity": {
    "workflow_id": "{{WORKFLOW_ID}}",
    "organization_id": "{{ORGANIZATION_ID}}",
    "project_id": "{{PROJECT_ID}}",
    "name": "{{WORKFLOW_NAME}}",
    "description": "{{WORKFLOW_DESCRIPTION}}",
    "template_id": "{{TEMPLATE_ID}}",
    "workflow_type": "ingestion",
    "domain_id": "{{DOMAIN_ID}}",
    "configuration": {
      "schedule": "0 */6 * * *",
      "batch_size": 500
    },
    "deployment": null,
    "status": "inactive",
    "metrics": {},
    "metadata": {
      "template_slug": "connector-ingestion",
      "ingestion_type": "connector_api_poll",
      "connector_id": "{{CONNECTOR_ID}}",
      "sync_entity": "{{SYNC_ENTITY}}",
      "storage_graph": {
        "enabled": true
      },
      "sync_mode": "realtime"
    },
    "created_at": "{{CREATED_AT}}",
    "updated_at": "{{UPDATED_AT}}"
  },
  "placeholders": {
    "{{WORKFLOW_ID}}": "Generated UUID",
    "{{ORGANIZATION_ID}}": "Organization ID",
    "{{PROJECT_ID}}": "Project ID",
    "{{WORKFLOW_NAME}}": "e.g. Shopify Orders",
    "{{WORKFLOW_DESCRIPTION}}": "Ingestion workflow for connector entity",
    "{{TEMPLATE_ID}}": "Stable template ID for connector-ingestion",
    "{{DOMAIN_ID}}": "Domain UUID",
    "{{CONNECTOR_ID}}": "Connector UUID",
    "{{SYNC_ENTITY}}": "Entity type (orders, products, customers)",
    "{{OWNER_USER_ID}}": "User ID for data product owner and ODPS dataHolder.dataProductOwner",
    "{{CREATED_AT}}": "ISO 8601",
    "{{UPDATED_AT}}": "ISO 8601"
  }
}
