{
  "template_type": "workflow",
  "slug": "service-requests-ingestion",
  "name": "Service Requests Preloaded Ingestion",
  "description": "Ingest public service requests from preloaded dataset into the Service Requests data product.",
  "version": "1.1.0",
  "produces_kind": "source",
  "tags": [
    "preloaded",
    "nonprofit_government",
    "ingestion",
    "service-requests"
  ],
  "entity": {
    "workflow_id": "{{WORKFLOW_ID}}",
    "organization_id": "{{ORGANIZATION_ID}}",
    "project_id": "{{PROJECT_ID}}",
    "domain_id": "{{DOMAIN_ID}}",
    "name": "{{WORKFLOW_NAME}}",
    "description": "Preloaded ingestion flow for public service requests",
    "workflow_type": "ingestion",
    "template_id": "e8085adc-b1ea-58ce-a9ec-6d07cdc0a568",
    "configuration": {
      "schedule": null,
      "batch_size": 100
    },
    "deployment": null,
    "status": "inactive",
    "metrics": {},
    "metadata": {
      "template_slug": "service-requests-ingestion",
      "ingestion_type": "preloaded"
    },
    "created_at": "{{CREATED_AT}}",
    "updated_at": "{{UPDATED_AT}}"
  }
}
